{
  "orgnr": "967032271",
  "navn": "SWECO NORGE AS",
  "oppstartdato" : null,
  "forretningsadresse": {
    "gateadresse": {
      "gatenummer" : null,
      "husbokstav" : null,
      "husnummer" : null,
      "gatenavn": "Drammensveien 260"
    },
    "postnr": "0283",
    "poststed": "OSLO",
    "land": "NORGE"
  },
  "organisasjonsform" : null,
  "postadresse": {
    "gateadresse": {
      "gatenummer" : null,
      "husbokstav" : null,
      "husnummer" : null,
      "gatenavn": "Postboks 80   Sk√∏yen"
    },
    "postnr": "0212",
    "poststed": "OSLO",
    "land": "NORGE"
  }
}
